<?xml version="1.0" encoding="utf-8"?>

<movie xmlns="http://www.swisscenter.co.uk"
       xmlns:xsi="http://www.w3.org/2001/XMLSchema-instance"
       xsi:schemaLocation="http://www.swisscenter.co.uk movies.xsd">
  <title>Austin Powers in Goldmember</title>
  <synopsis>The 3rd installment of Austin Powers</synopsis>
  <description>
    He's found his mojo, baby, and now Austin Powers (Mike Myers) is back again in this shagadelic
    comedy-adventure! The "sshhh!" hits the fan when Dr. Evil and Mini-Me escape from prison.
    Joining forces with the superfreaky Goldmember, they kidnap Austin's father, master spy Nigel
    Powers (Michael Caine), in a dastardly time-travel scheme to take over the world. Before you
    can say "Shake Your Booty," Austin cruises to 1975 and teams up with sexy Foxxy Cleopatra
    (Beyonce Knowles) to stop Dr. Evil and Goldmember from their mischievous mayhem. With Michael
    York, Robert Wagner, Seth Green, Mindy Sterling and Verne J. Troyer.
  </description>
  <actors>
    <actor>
      <name>Mike Myers</name>
      <characters>
        <character>Austin Powers</character>
        <character>Dr. Evil</character>
        <character>Fat Bastard</character>
        <character>Goldmember</character>
      </characters>
    </actor>
    <actor>
      <name>Beyonce Knowles</name>
      <character>Foxxy Cleopatra</character>
    </actor>
    <actor>
      <name>Seth Green</name>
      <character>Scott Evil</character>
    </actor>
    <actor>
      <name>Michael York</name>
      <character>Basil Exposition</character>
    </actor>
    <actor>
      <name>Robert Wagner</name>
      <character>Number Two</character>
    </actor>
    <actor>
      <name>Fred Savage</name>
    </actor>
    <actor>
      <name>Nobu Matsuhisa</name>
    </actor>
  </actors>
  <certificates>
    <certificate region="UK">12</certificate>
    <certificate region="US">PG-13</certificate>
  </certificates>
  <genres>
    <genre>Comedy</genre>
    <genre>Action</genre>
    <genre>Adventure</genre>
  </genres>
  <directors>
    <director>Fred Flintstone</director>
  </directors>
  <language>English</language>
  <runtime>94</runtime>
  <tagline>On July 26th the Secret Will Be Exposed</tagline>
  <year>2002</year>
  <filmsites>
    <filmsite parser="lovefilm">http://www.lovefilm.com/view_dvd.php?dt_id=3043&amp;se_id=15470823&amp;se_off=1&amp;se_type=title</filmsite>
    <filmsite parser="dvdplanet">http://www.dvdplanet.com/product_listing.asp?productid=27691&amp;format=DVD</filmsite>
  </filmsites>
</movie>
